{"sentAt":"2026-12-22T01:31:07.000Z","power":{"batteryPercent":87,"charging":true,"batteryTempC":31.5,"thermalStatus":"none"},"radio":{"networkType":"LTE","signalDbm":-95,"signalLevel":3,"airplaneMode":false,"connected":true},"gps":{"provider":"fused","satellitesUsed":9,"satellitesInView":14,"lastFixAccuracyM":6,"lastFixAgeS":1,"fixesLastMinute":58,"permission":{"foreground":true,"background":true,"precise":true}},"transport":{"socketState":"connected","reconnectCount":2,"httpFallbackSeconds":0,"lastReceiptLatencyMs":120,"sendsFailedSinceBoot":3},"process":{"deviceUptimeS":90000,"serviceUptimeS":3000,"serviceRestartCount":1,"memoryPressure":"normal","batteryOptimizationExempt":true,"notificationPermission":true,"systemApp":true,"rootAvailable":true},"identity":{"deviceModel":"Pixel 6a","androidVersion":"14","appVersion":"1.0.3","clockSkewMs":-120}}